{
  "case_id": "authoring_57a1e001",
  "class": "stale_frontier",
  "expected_outcome": {
    "checks": [
      {
        "id": "uses_revalidation_path",
        "kind": "act_sequence",
        "mode": "contains_in_order"
      },
      {
        "id": "stale_focus_refused",
        "kind": "act_status",
        "seq": 1,
        "status": "refused"
      },
      {
        "id": "revalidates_suite_state",
        "kind": "act_output_matches",
        "seq": 3,
        "pattern": "(?i)TestBeacon(Current|Fallback).*(pass|fail)|(pass|fail).*TestBeacon(Current|Fallback)"
      }
    ]
  },
  "grading_script": "sha256:7b7438f84164d69157bbde87fd3ffb2f88e069bb01a97785a737910e29df0e05",
  "acceptable_paths": [["tests.list", "tests.focus", "tests.list", "tests.focus"]],
  "label_rationale": "The fixture starts with a changed catalog. A state-bound frontier call must fail safely and lead to a fresh listing before another focus."
}
